1D6D0345-B3E5-4E0F-87A3-0A98B9A17073,UnicornFluffy,Stylish Fluffy Unicorn Slippers,100.00,UnicornFluffy,2007-04-30 13:10:02.047,10
CCD7C56E-1A10-402F-B085-1305AAB6C497,UnicornBeddings,Rainbow Unicorn Bedding Set - The Perfect Kids or Adults Unicorn Duvet Set,100.00,UnicornBeddings,2007-04-30 13:10:02.047,10
B5B16437-ADEB-44F2-BE15-26E25C5F4DEA,UnicornCool,Cool Dabbing Unicorn Mens Hip-hop Shirts,100.00,UnicornCool,2007-04-30 13:10:02.047,10
2291781A-0097-4AE0-822B-36628AFAFCA2,UnicornPartyDress,Girls Unicorn Party Dress - Tutu Pastel Rainbow Princess Power,100.00,UnicornPartyDress,2007-04-30 13:10:02.047,10
A89E48F9-940D-40B2-A5E3-4837AF5467CF,UnicornBlanket,Superfun Bestselling Unicorn Hooded Blanket,100.00,UnicornBlanket,2007-04-30 13:10:02.047,10
05FE0BD1-B940-4E1F-A236-4CFC98E231CE,UnicornFloat,Big Unicorn Float! Giant Glitter Unicorn Pool Floaty,100.00,UnicornFloat,2007-04-30 13:10:02.047,10
5044DABA-ABEC-4E10-9A3D-B2272715175C,UnicornHipHop,Rainbow Hip Hop Unicorn With Sunglasses Kids Tshirt,100.00,UnicornHipHop,2007-04-30 13:10:02.047,10
5929DDD0-4343-40A9-9AB5-CDE068E41A6D,UnicornPink,Pretty Pink Baby Unicorn Summer Party Dress,100.00,UnicornPink,2007-04-30 13:10:02.047,10
887C5538-4464-40F6-A825-E6549194FD2F,UnicornBackpack,Top Rated Classy Unicorn Backpack - Kawaii School Bag,100.00,UnicornBackpack,2007-04-30 13:10:02.047,10
66FD970E-C814-4722-B243-FBF3E97E0AE4,UnicornGlitter,Unicorn Glitter Backpack - Shop for Unique Unicorn Gifts for Girls!,100.00,UnicornGlitter,2007-04-30 13:10:02.047,10